{
  "schema_version": 3,
  "artifact_id": "domainlease-r11-k0-semantic-foundation-v3",
  "language_id": "DL-SemFoundation-3",
  "status": "local_K0_candidate_external_adoption_absent",
  "gate": "K0_G0_FOUNDATION",
  "normative_spec": {
    "path": "capsched-models/policy/r11/epoch2/semantic-foundation-v3.md",
    "role": "primary_mathematical_denotation",
    "interpreter_defines_semantics": false
  },
  "denotation_clauses": [
    {"id":"SF-DEN-001","title":"Signature and Interpretation","normative":true},
    {"id":"SF-DEN-002","title":"Sort Carriers","normative":true},
    {"id":"SF-DEN-003","title":"State Products","normative":true},
    {"id":"SF-DEN-004","title":"Events Parameters and Action Relations","normative":true},
    {"id":"SF-DEN-005","title":"Phase-Safe Terms","normative":true},
    {"id":"SF-DEN-006","title":"Total Expression Forms","normative":true},
    {"id":"SF-DEN-007","title":"Read May-Write and Frame Semantics","normative":true},
    {"id":"SF-DEN-008","title":"Init Required Action Closure Next and Stutter","normative":true},
    {"id":"SF-DEN-009","title":"Enabledness and Occurrence","normative":true},
    {"id":"SF-DEN-010","title":"Traces and Prefixes","normative":true},
    {"id":"SF-DEN-011","title":"Safety and Reachability Satisfaction","normative":true},
    {"id":"SF-DEN-012","title":"Progress and Fairness Extension","normative":true},
    {"id":"SF-DEN-013","title":"Timed and Provider Extension","normative":true},
    {"id":"SF-DEN-014","title":"Transaction Durability Crash and Recovery Extension","normative":true},
    {"id":"SF-DEN-015","title":"Distributed Extension","normative":true},
    {"id":"SF-DEN-016","title":"Two-Trace Noninterference Extension","normative":true},
    {"id":"SF-DEN-017","title":"Parametric and Finite Claim Boundary","normative":true},
    {"id":"SF-DEN-018","title":"Backend and TCB Boundary","normative":true}
  ],
  "signature_namespaces": ["SORT","UNIT","LIMIT","PRODUCT","CONSTANT","EVENT","ACTION"],
  "sort_forms": [
    {"id":"BOOL","clause":"SF-DEN-002"},
    {"id":"ATOM","clause":"SF-DEN-002"},
    {"id":"ENUM","clause":"SF-DEN-002"},
    {"id":"QTY","clause":"SF-DEN-002"},
    {"id":"PROD","clause":"SF-DEN-002"},
    {"id":"SUM","clause":"SF-DEN-002"},
    {"id":"OPTION","clause":"SF-DEN-002"},
    {"id":"FINSET","clause":"SF-DEN-002"},
    {"id":"TOTALMAP","clause":"SF-DEN-002"},
    {"id":"ONE-SORT","clause":"SF-DEN-002"}
  ],
  "term_judgments": [
    {"id":"TERM","clause":"SF-DEN-005","notes":"Term<T,R> with R subset of PRE POST EVENT"},
    {"id":"STATIC-TERM","clause":"SF-DEN-005"},
    {"id":"PRE-TERM","clause":"SF-DEN-005"},
    {"id":"POST-TERM","clause":"SF-DEN-005"},
    {"id":"STATE-PRED","clause":"SF-DEN-005"},
    {"id":"ACTION-REL","clause":"SF-DEN-005"}
  ],
  "base_expression_forms": [
    {"id":"BOOL-LITERAL","clause":"SF-DEN-006","total":true,"read_effect":"NONE","result":"Bool"},
    {"id":"TYPED-LITERAL","clause":"SF-DEN-006","total":true,"read_effect":"NONE","result":"declared sort"},
    {"id":"VARIABLE","clause":"SF-DEN-006","total":true,"read_effect":"NONE","result":"environment sort"},
    {"id":"LET","clause":"SF-DEN-006","total":true,"read_effect":"COMPOSITIONAL","result":"body sort"},
    {"id":"PRODUCT-CONSTRUCT","clause":"SF-DEN-006","total":true,"read_effect":"COMPOSITIONAL","result":"declared product sort"},
    {"id":"PRODUCT-FIELD","clause":"SF-DEN-006","total":true,"read_effect":"COMPOSITIONAL","result":"declared field sort"},
    {"id":"SUM-CONSTRUCT","clause":"SF-DEN-006","total":true,"read_effect":"COMPOSITIONAL","result":"declared sum sort"},
    {"id":"SUM-MATCH","clause":"SF-DEN-006","total":true,"read_effect":"COMPOSITIONAL","result":"common exhaustive branch sort"},
    {"id":"MAP-GET","clause":"SF-DEN-006","total":true,"read_effect":"COMPOSITIONAL","result":"map value sort"},
    {"id":"MAP-SET","clause":"SF-DEN-006","total":true,"read_effect":"COMPOSITIONAL","result":"same total-map sort"},
    {"id":"SET-EMPTY","clause":"SF-DEN-006","total":true,"read_effect":"NONE","result":"declared finite-set sort"},
    {"id":"SET-INSERT","clause":"SF-DEN-006","total":true,"read_effect":"COMPOSITIONAL","result":"same finite-set sort"},
    {"id":"SET-REMOVE","clause":"SF-DEN-006","total":true,"read_effect":"COMPOSITIONAL","result":"same finite-set sort"},
    {"id":"SET-MEMBER","clause":"SF-DEN-006","total":true,"read_effect":"COMPOSITIONAL","result":"Bool"},
    {"id":"SET-SUBSET","clause":"SF-DEN-006","total":true,"read_effect":"COMPOSITIONAL","result":"Bool"},
    {"id":"SET-UNION","clause":"SF-DEN-006","total":true,"read_effect":"COMPOSITIONAL","result":"same finite-set sort"},
    {"id":"SET-DIFFERENCE","clause":"SF-DEN-006","total":true,"read_effect":"COMPOSITIONAL","result":"same finite-set sort"},
    {"id":"BOOL-AND","clause":"SF-DEN-006","total":true,"read_effect":"COMPOSITIONAL","result":"Bool"},
    {"id":"BOOL-OR","clause":"SF-DEN-006","total":true,"read_effect":"COMPOSITIONAL","result":"Bool"},
    {"id":"BOOL-NOT","clause":"SF-DEN-006","total":true,"read_effect":"COMPOSITIONAL","result":"Bool"},
    {"id":"BOOL-IMPLIES","clause":"SF-DEN-006","total":true,"read_effect":"COMPOSITIONAL","result":"Bool"},
    {"id":"BOOL-IFF","clause":"SF-DEN-006","total":true,"read_effect":"COMPOSITIONAL","result":"Bool"},
    {"id":"SAME-SORT-EQ","clause":"SF-DEN-006","total":true,"read_effect":"COMPOSITIONAL","result":"Bool"},
    {"id":"QTY-ORDER","clause":"SF-DEN-006","total":true,"read_effect":"COMPOSITIONAL","result":"Bool"},
    {"id":"QTY-ADD","clause":"SF-DEN-006","total":true,"read_effect":"COMPOSITIONAL","result":"ArithResult of same Qty sort"},
    {"id":"QTY-SUB","clause":"SF-DEN-006","total":true,"read_effect":"COMPOSITIONAL","result":"ArithResult of same Qty sort"},
    {"id":"IF","clause":"SF-DEN-006","total":true,"read_effect":"COMPOSITIONAL","result":"common branch sort"},
    {"id":"FORALL","clause":"SF-DEN-006","total":true,"read_effect":"COMPOSITIONAL","result":"Bool"},
    {"id":"EXISTS","clause":"SF-DEN-006","total":true,"read_effect":"COMPOSITIONAL","result":"Bool"},
    {"id":"PRE-READ","clause":"SF-DEN-005","total":true,"read_effect":"PRE","result":"state-product value sort"},
    {"id":"POST-READ","clause":"SF-DEN-005","total":true,"read_effect":"POST","result":"state-product value sort"},
    {"id":"EVENT-READ","clause":"SF-DEN-005","total":true,"read_effect":"EVENT","result":"Event"}
  ],
  "model_entities": [
    {"id":"INTERPRETATION","clause":"SF-DEN-001"},
    {"id":"STATE","clause":"SF-DEN-003"},
    {"id":"EVENT-VALUE","clause":"SF-DEN-004"},
    {"id":"ACTION-FAMILY","clause":"SF-DEN-004"},
    {"id":"ACTION-LABEL","clause":"SF-DEN-004"},
    {"id":"STUTTER","clause":"SF-DEN-008"},
    {"id":"NEXT","clause":"SF-DEN-008"},
    {"id":"ENABLED","clause":"SF-DEN-009"},
    {"id":"TRACE","clause":"SF-DEN-010"},
    {"id":"FINITE-PREFIX","clause":"SF-DEN-010"}
  ],
  "extensions": [
    {"id":"PROGRESS-FAIRNESS","clause":"SF-DEN-012"},
    {"id":"TIMED-PROVIDER","clause":"SF-DEN-013"},
    {"id":"TRANSACTION-DURABILITY","clause":"SF-DEN-014"},
    {"id":"DISTRIBUTED","clause":"SF-DEN-015"},
    {"id":"TWO-TRACE-NONINTERFERENCE","clause":"SF-DEN-016"}
  ],
  "obligation_families": [
    {"id":"INIT-NONEMPTY","clause":"SF-DEN-011"},
    {"id":"INIT-SAFE","clause":"SF-DEN-011"},
    {"id":"ACTION-INDUCTIVE","clause":"SF-DEN-011"},
    {"id":"ALWAYS-SAFETY","clause":"SF-DEN-011"},
    {"id":"ACTION-BRANCH-REACHABLE","clause":"SF-DEN-011"},
    {"id":"REACHABLE-ANTECEDENT","clause":"SF-DEN-011"},
    {"id":"FRAME-EXACT","clause":"SF-DEN-007"},
    {"id":"ACTION-CLOSURE","clause":"SF-DEN-008"},
    {"id":"WEAK-FAIRNESS","clause":"SF-DEN-012"},
    {"id":"STRONG-FAIRNESS","clause":"SF-DEN-012"},
    {"id":"RESPONSE","clause":"SF-DEN-012"},
    {"id":"TIMED-BOUND","clause":"SF-DEN-013"},
    {"id":"CUT-RECOVERY-RECRASH","clause":"SF-DEN-014"},
    {"id":"TRANSFER-CONSERVATION","clause":"SF-DEN-015"},
    {"id":"RELATIONAL-NONINTERFERENCE","clause":"SF-DEN-016"},
    {"id":"BACKEND-PRESERVATION","clause":"SF-DEN-018"}
  ],
  "finite_claim_boundary": {
    "architecture_carriers_parametric": true,
    "finite_profile_is_separate": true,
    "bounded_no_counterexample_implies_general_claim": false,
    "finite_counterexample_refutes_corresponding_general_claim": true,
    "generalization_requires": ["accepted induction", "accepted refinement", "checked symmetry premises", "other claim-specific proof"]
  },
  "backend_boundary": {
    "reference_evaluator": "untrusted producer implementing the normative denotation",
    "Z3": "untrusted differential backend",
    "cvc5": "untrusted differential backend",
    "TLA": "post-K2 untrusted translation target",
    "differential_agreement_is_translation_proof": false,
    "accepted_backend_requires": ["compositional semantics-preservation evidence", "or proof-producing per-artifact translation validation"],
    "minimal_TCB": ["strict parser/canonicalizer", "phase/type checker", "faithful denotation implementation or small certificate checker", "translation certificate checker", "root/checkpoint/high-water verifier"]
  },
  "authorization": {
    "local_K0_candidate": true,
    "external_K0_adoption": false,
    "candidate_IR": false,
    "semantic_freeze": false,
    "TLA_translation": false,
    "model_supported": false,
    "linux_behavior_change": false,
    "protection_claim": false
  }
}
